Name,Type,Subtype,Effect,Red,Blue,Green,Colorless,Power,Writer,Artist,Edition,ID,Anecdote
"Clay",Being,Clay,"On enter: If you have a human, draw a human.",0,0,0,0,0,Akkadian,Flux2:Klein9b,Alpha0.3.0,,"""Aruru washed her hands, she pinched off clay and cast it on the steppe. On the steppe she created Enkidu to rival Gilgamesh's power."""
"Ninsun, Mother of Gilgamesh",Being,God,"On enter: Search your deck for Gilgamesh and add him to your hand. If he is already in play, move him to this location instead.",0,0,0,1,1,Akkadian,Flux2:Klein9b,Alpha 0.3.0,,"""O Ninsun, you are wise and know everything... Intercede for me with Shamash the Sun-God, for my path is long."""
"Alewife Siduri",Being,Human,On enter: You may move one of your beings here to another location.,0,0,0,1,2,Akkadian,Flux2:Klein9b,Alpha 0.3.0,,"""'Gilgamesh, where are you hurrying? You will never find that life for which you looking.'"""
"Trapper",Being,Human,"On enter: Draw Enkidu",0,0,0,1,1,Akkadian,Flux2:Klein9b,Alpha0.3.0,,"""A hunter, a trapper, faced Enkidu at the watering hole... 'Father, a man has come from the hills, he fills up my pits and breaks my traps.'"""
"Gilgamesh",Being,"Human, Hero, King","Gilgamesh's power is equal to 1 + the power of all monsters in your underworld. While Enkidu is at the same location as Gilgamesh, they are immortal",0,0,0,1,1+,Akkadian,Sana1.5:1.6b,Alpha 0.3.0,,"""He built the walls of Uruk, the sacred storehouse. Two-thirds of him is god, and one-third is human."""
"Enkidu",Being,"Human, Hero","While on top: You may move Enkidu to Gilgamesh. Enkidu's Power is equal to Gilgamesh's.",0,0,0,1,*,Akkadian,Sana1.5:1.6b,Alpha 0.3.0,,"""With the gazelles he eats wild grass, with the beasts he jostles at the waterhole. He knew neither people nor a homeland."""
"Shamhat",Being,"Human, Priestess","On enter: Play Enkidu here from your hand, deck, or underworld.",0,0,0,2,2,Akkadian,Flux2:Klein9b,Alpha 0.3.0,,"""Shamhat bared her bosom, and he possessed her ripeness... For six days and seven nights Enkidu stayed erect, and forgot the wild where he was born."""
"Ferryman Urshanabi",Being,"Human, Underworld Guide","On enter: You may move one of your heroes to here.",0,0,0,2,3,Akkadian,Flux2:Klein9b,Alpha 0.3.0,,"""'He is the one who crosses the Waters of Death, to reach Utnapishtim the Faraway.'"""
"Mountain Lions",Being,"Beast, Monster","Cannot be played at a location where you have heroes. Defeated when you have one or more heroes here. Reward: Draw a card and move a hero from here to another location.",0,0,0,1,1,Akkadian,Flux2:Klein9b,Alpha 0.3.0,,"""'When I arrived at the mountain passes at night, I saw lions and grew terrified. I raised my axe and struck them down.'"""
"Scorpion-Men",Being,"Beast, Monster","Cannot be played at a location where you have heroes. Defeated when you have one or more heroes here. Reward: Draw two cards.",0,0,0,2,3,Akkadian,Flux2:Klein9b,Alpha 0.3.0,,"""At the mountains of Mashu, Scorpio-men guard the gate... whose glance is death, whose radiant halo sweeps the peaks."""
"The Serpent",Being,"Beast, Monster","Cannot be played at a location where you have heroes. Defeated when you have one or more heroes here. Reward: Each opponent must discard a card.",0,0,0,3,4,Akkadian,Flux2:Klein9b,Alpha 0.3.0,,"""A serpent caught the scent of the plant of youth; it came up silently from the pool and snatched it away, instantly shedding its old skin."""
"Ishtar",Being,God,"While on top: Whenever one of your heroes moves away from here, each opponent must banish a creature with a cost of [2] or lower.",0,0,0,4,7,Akkadian,Flux2:Klein9b,Alpha 0.3.0,,"""Princess Ishtar raised her eyes to his beauty: 'Come, Gilgamesh, be my husband! But he replied: Which of your lovers did you ever love forever?'"""
"Utnapishtim, Survivor of the Flood",Being,"Human, King",Immortal.,0,0,0,4,8,Akkadian,Flux2:Klein9b,Alpha 0.3.0,,"""'Man of Shuruppak, build a great boat! Abandon wealth and look for life... For the gods have given me eternal life among the stars.'"""
"Humbaba, Guardian of the Cedar Forest",Being,"Plant, Monster","Cannot be played at a location where you have heroes. Defeated when you have two or more heroes here. Reward: You may play a card of cost [5] or less for free.",0,0,0,4,5,Akkadian,Sana1.5:1.6b,Alpha 0.2.0,hwJJK90X4Tw,"""His roar is the Flood, his mouth is Fire, his breath is Death. Enlil appointed him to guard the Cedar Forest to terrify mortals."""
"Bull of Heaven",Being,"God, Monster","Cannot be played at a location where you have heroes. Defeated when you have two or more heroes here. Reward: Each opponent must banish two of their beings.",0,0,0,5,6,Akkadian,Flux2:Klein9b,Alpha 0.3.0,,"""Ishtar cried to her father: 'Create the Bull of Heaven to strike Gilgamesh down!' With its first snort, a chasm opened and swallowed a hundred men."""
"Šara, Inanna's Beautician",Being,"Deity, Artist","On enter: Draw 'Inanna, Goddess of Love and War' from your deck.",0,0,0,1,2,Sumerian,Sana1.5:1.6b,Alpha 0.2.0,,"'Šara is my singer, my manicurist and my hairdresser. How could I turn him over to you?'"
"Kur-Jara",Being,"Enki's Creation","On enter: If 'Gala-Tura' is at this location, revive a being with a cost of [3] or less.",0,0,0,1,2,Sumerian,Sana1.5:1.6b,Alpha 0.2.0,,"He removed some dirt from the tip of his fingernail and created the kur-jara. To the kur-jara he gave the life-giving plant."
"Gala-Tura",Being,"Enki's Creation","On enter: If 'Kur-Jara' is at this location, revive a being with a cost of [3] or less.",0,0,0,1,2,Sumerian,Sana1.5:1.6b,Alpha 0.2.0,,"He removed some dirt from the tip of his other fingernail and created the gala-tura. To the gala-tura he gave the life-giving water."
"Gatekeeper Neti",Being,"Underworld, Guardian","On enter: You may put a being from your hand into your underworld.",0,0,0,2,3,Sumerian,Sana1.5:1.6b,Alpha 0.2.0,,"'Be satisfied, Inanna, a divine power of the underworld has been fulfilled. You must not open your mouth against the rites of the underworld.'"
"Ninšubur, Sukkal to Inanna",Being,"Deity, Sukkal","On enter: If 'Inanna, Goddess of Love and War' is in your underworld, you may banish a friendly being to revive her.",0,0,0,2,3,Sumerian,Sana1.5:1.6b,Alpha 0.2.0,,"She did not forget her orders, she did not neglect her instructions. Like a pauper, she clothed herself in a single garment."
"Galla Demons",Being,"Underworld, Demon","On enter: You must banish one of your other beings if possible.",0,0,0,2,4,Sumerian,Sana1.5:1.6b,Alpha 0.2.0,,"Those who accompanied her know no food, know no drink. They accept no pleasant gifts. They never enjoy the pleasures of the marital embrace."
"Geshtinanna, Dumuzid's Sister",Being,"Deity, Poet","While on top: Once per turn, you may banish this being to revive 'Dumuzid, Shepherd God'. On Revive: Draw a card.",0,0,0,2,4,Sumerian,Sana1.5:1.6b,Alpha 0.2.0,,"'You for half the year and your sister for half the year: when you are demanded, on that day you will stay, when your sister is demanded, on that day you will be released.'"
"Sirtur, Mourning Mother",Being,"Deity","On enter: Revive 'Dumuzid, Shepherd God' or 'Geshtinanna, Dumuzid's Sister'.",0,0,0,2,3,Sumerian,Sana1.5:1.6b,Alpha 0.2.0,,"Mother of Dumuzid, she mourned at the edge of the steppe, weeping for her shepherd son."
"Dirt under Enki's Fingernail",Being,"Deity","On enter: Draw 'Kur-Jara' and 'Gala-Tura' from your deck.",0,0,0,2,3,Sumerian,Sana1.5:1.6b,Alpha 0.2.0,,"'What has my daughter done? She has me worried. What has the mistress of all the lands done? She has me worried.'"
"Underworld Courier",Being,"Deity, Sukkal","On enter: Put a being from your hand into your underworld.",0,0,0,3,6,Sumerian,Sana1.5:1.6b,Alpha 0.2.0,,"Vizier of the Queen of the Dead, whose touch brings plague and whose word is fate."
"Inanna, Goddess of Love and War",Being,"Deity","On revive: For every opponent, banish one of their beings if possible.",0,0,0,3,5,Sumerian,Sana1.5:1.6b,Alpha 0.2.0,,"From the great heaven she set her mind on the great below. My mistress abandoned heaven, abandoned earth, and descended to the underworld."
"Dumuzid, Shepherd God",Being,"Deity, Shepherd","While on top: Once per turn, you may banish this being to revive 'Geshtinanna, Dumuzid's Sister'.",0,0,0,4,7,Sumerian,Sana1.5:1.6b,Alpha 0.2.0,,"There was Dumuzid clothed in a magnificent garment and seated magnificently on a throne. She looked at him — it was the look of death."
"Lulal, Inanna's Bodyguard",Being,"Deity, Warrior","On enter: Revive 'Inanna, Goddess of Love and War'.",0,0,0,4,4,Sumerian,Sana1.5:1.6b,Alpha 0.2.0,,"'Outstanding Lulal follows me at my right and my left. How could I turn him over to you?'"
"Namtar, Sukkal to Ereshkigal",Being,"Deity, Underworld","On enter: Put any being from your hand, deck or battlefield into your underworld.",0,0,0,4,7,Sumerian,Sana1.5:1.6b,Alpha 0.2.0,,"Her holy shoulders were not covered by a linen cloth. Her nails were like a pickaxe upon her. The hair on her head was bunched up as if it were leeks."
"Anunnaki, The Seven Judges",Being,"Deity, Underworld","While on top: Whenever you revive a being, each opponent must banish one of their beings.",0,0,0,5,8,Sumerian,Sana1.5:1.6b,Alpha 0.2.0,,"They looked at her — it was the look of death. They spoke to her — it was the speech of anger."
