Name,Type,Subtype,Effect,Red,Blue,Green,Colorless,Power,Writer,Artist,Edition,ID,Anecdote
"The Great Sumerian Deluge",Catastrophe,Flood,"Put this aside at the start of the game. The first time there are 8 or more humans in play, the flood happens at the end of that turn. The Flood: Banish all humans.",0,0,0,0,0,Akkadian,ZImageTurbo,Alpha 0.3.0,,"'The noise of mankind has become too much. I am disturbed by their uproar. Sleep no longer comes to me.' — Enlil, before the council"
"Cuneiform Tablets of Ea",Artefact,Tablet,"On enter: Search your deck for 'The Ark' and add it to your hand. While on top: You may discard a card to look at the top 3 cards of your deck and arrange them in any order.",0,0,0,1,0,Akkadian,ZImageTurbo,Alpha 0.3.0,,'Take the design of the ship I draw for you on the ground! Let its dimensions be measured exactly...'
"Flies",Being,"Insect","If a being left the world this turn, you may play this for free.",0,0,0,1,2,Akkadian,ZImageTurbo,Alpha 0.3.0,,"They come where something has ended. They are never far behind."
"Slave",Being,"Human","While on top: You may banish this to play your next artefact this turn for [2] less.",0,0,0,1,1,Akkadian,ZImageTurbo,Alpha 0.3.0,,"His hands know the weight of stone and brick. He has built the city. He will not be remembered in it."
"Shepherd",Being,"Human","On enter: The next human you play costs [1] less.",0,0,0,1,1,Akkadian,ZImageTurbo,Alpha 0.3.0,,"Where he walks, others follow. He does not ask them to."
"Farmer",Being,"Human","On enter: Play another 1 cost human for free.",0,0,0,1,1,Akkadian,ZImageTurbo,Alpha 0.3.0,,"The field is never worked alone. One calls to his neighbor, and his neighbor comes."
"Fisherman",Being,"Human","On enter: Draw two humans from your underworld.",0,0,0,2,3,Akkadian,ZImageTurbo,Alpha 0.3.0,,"He casts his net into the dark water and pulls out what the deep sees fit to return."
"Sacrificer at the Altar",Being,"Human, Priest","On enter: If the flood would happen at the end of this turn, it happens at the end of your next turn instead.",0,0,0,2,4,Akkadian,ZImageTurbo,Alpha0.3.0,,"The gods are not easily turned. But they can be made to wait."
"Weeping Mother Goddess",Being,"Deity","On enter: Choose one of your humans with a cost of [2] or less and return it to its owner's hand.",0,0,0,2,4,Akkadian,ZImageTurbo,Alpha 0.3.0,,"'How could I have agreed to destroy my own children in the council of gods?' She would not be consoled."
"Shipbuilder",Being,"Human","While on top: Artifacts you play cost [1] less.",0,0,0,2,3,Akkadian,ZImageTurbo,Alpha 0.3.0,,"He has never asked what the ship is for. He asks only whether the joints will hold."
"Citizen of Shruppak",Being,"Human","On enter: Draw two humans.",0,0,0,3,4,Akkadian,ZImageTurbo,Alpha 0.3.0,,"Shruppak was a city that knew the gods. Its streets were full, and its walls were old. It did not think the world could end."
"Elders of Shuruppak",Being,Human,"While on top: Double the power of all your humans here.",0,0,0,3,0,Akkadian,ZImageTurbo,Alpha 0.3.0,,"They have seen five kings come and go. When they speak, even the young men are quiet."
"Atrahasis, Flood Survivor",Being,"Human, King","Immortal.",0,0,0,4,8,Akkadian,ZImageTurbo,Alpha 0.3.0,,"Ea leaned close to the wall of reeds and spoke just loud enough for one man to hear. That was all it took."
"Enlil, Storm God",Being,"Deity","On enter: If there are two or more humans here, you may unleash the flood at this location.",0,0,0,7,5,Akkadian,ZImageTurbo,Alpha 0.3.0,,"He did not hate them. He simply could not sleep."
"The Ark",Artefact,"Boat","Costs [1] less for each of your humans. Indestructible. On enter: Choose a location. While on top: Your humans on chosen location are protected from the flood.",0,0,0,13,12,Akkadian,ZImageTurbo,Alpha 0.3.0,,"Six decks, seven compartments, nine sections. Pitch sealed every seam. Inside: gold, silver, all living things, his kin, the craftsmen, the cattle of the field. The rain began at dawn."
"Eurybates, Herald of Odysseus",Being,"Human, Herald","On enter: Draw 'Odysseus'.",0,0,0,1,2,Greek,ZImageTurbo,Alpha 0.3.0,,"'Of all his heralds, Odysseus valued Eurybates most — round-shouldered, dark, and sharper than he looked.'"
"Calchas, Prophet of Apollo",Being,Human,"On enter: Look at the top 2 cards of your deck. Put one into your hand and the other at the bottom.",0,0,0,1,1,Greek,ZImageTurbo,Alpha 0.3.0,,"'He alone could read the flight of birds, and told the Greeks what the gods demanded before the fleet could sail.'"
"Sinon the Deceiver",Being,"Human, Spy","On enter: Move this card to the opponent's side of this location. While on top: The opponent must play with their hand revealed.",0,0,0,1,-1,Greek,ZImageTurbo,Alpha 0.3.0,,"'He stood before the Trojans, hands bound, and told them exactly enough of the truth to be believed.'"
"Greek Soldiers",Being,"Human, Soldier","When Greek Soldiers move to the opponent's side of this location: For that opponent, you may destroy up to five of their beings with Power [1] or less.",0,0,0,1,2,Greek,ZImageTurbo,Alpha 0.3.0,,"'In the darkness of the horse's belly we waited, crouched, armed, silent. Sinon's torch was the signal.'"
"Dolon the Scout",Being,"Human, Spy","On enter: Move this card to the opponent's side of this location. While on top: Once per turn you may look at the top card of the opponent's deck and choose to put it on the bottom.",0,0,0,2,-2,Greek,ZImageTurbo,Alpha 0.3.0,,"'He wore the wolf-skin and went out alone into the dark, certain no one would catch him. He was wrong.'"
"Menelaus, the Wronged King",Being,"Human, Hero, King","While on top: This card has +2 Power for each card the opponent controls more than you at this location.",0,0,0,2,2,Greek,ZImageTurbo,Alpha 0.3.0,,"'Ten years. Not for glory. Not for Agamemnon's pride. He simply refused to be the man whose wife left and who did nothing.'"
"Camp Guard at the Ships",Being,"Human, Sentry","On enter: Draw 1 card. If you control a card on the opponent's side of the location, draw 2 cards instead.",0,0,0,2,3,Greek,ZImageTurbo,Alpha 0.3.0,,"'His orders were simple: watch the plain, and shout if the fires moved.'"
"Epeius, Builder of the Horse",Being,"Human, Artisan","On enter: Draw 'The Trojan Horse'.",0,0,0,2,3,Greek,ZImageTurbo,Alpha 0.3.0,,"'Athena herself guided his hands. He wept as he built it, knowing what it was for.'"
"Odysseus",Being,"Human, Hero","On enter: Move a card here to any location at any side.",0,0,0,3,5,Greek,ZImageTurbo,Alpha 0.3.0,,"'He is never at a loss. That is what makes him dangerous.'"
"Patroclus",Being,"Human, Hero","On enter and if Achilles is in play: For each opponent destroy an enemy Being here with Power equal to or less than Patroclus.",0,0,0,3,4,Greek,ZImageTurbo,Alpha 0.3.0,,"'He put on Achilles' armour, and the Trojans broke before him — until they didn't.'"
"The Trojan Horse",Artefact,Structure,"When this card moves to the opponent's side of the location: You may move any number of your Humans with it. Flip them face-down; they have −6 Power.",0,0,0,3,0,Greek,ZImageTurbo,Alpha 0.3.0,,"'They brought it inside themselves. That was always the plan.'"
"Ajax, the Great",Being,"Human, Hero","While on top: Your Beings here cannot be moved by opponent card effects.",0,0,0,4,8,Greek,ZImageTurbo,Alpha 0.3.0,,"'He gave ground for nothing and no one. When the others fled to the ships, Ajax walked backwards, facing the enemy.'"
"Agamemnon, King of Mycenae",Being,"Human, Hero, King","While on top: The opponent can have a maximum of 3 cards on their side of this location.",0,0,0,4,6,Greek,ZImageTurbo,Alpha 0.3.0,,"'He was not the greatest warrior, nor the wisest. He was simply the one no one could ignore — and he never let them forget it.'"
"Achilles",Being,"Human, Hero","On enter: For each opponent, destroy an enemy Being here with Power equal to or less than Achilles. If Patroclus is in the underworld: For each opponent, destroy the strongest enemy Being here instead.",0,0,0,5,7,Greek,ZImageTurbo,Alpha 0.3.0,,"'He knew he would not return. He chose to come anyway.'"
"Diomedes, the God-Smiter",Being,"Human, Hero","While on top: For each opponent, their strongest deity's power here is counted as 0.",0,0,0,5,7,Greek,ZImageTurbo,Alpha 0.3.0,,"'He drove his spear into Ares, and the war god screamed. Even gods can bleed.'"